{
  "coverage_id": "cov-d24db19465f5",
  "repository_pin": "pins/v0-boundary-drift/steward.json",
  "procedure_id": "boundary-drift-recon-v0",
  "procedure_version": "v0",
  "capabilities_used": ["git", "gh", "rg", "bash", "python3", "jq"],
  "capabilities_missing": [],
  "result": "success",
  "inspected_at": "2026-09-02T04:58:33Z"
}
