{
  "coverage_id": "cov-d32b1508ac64",
  "repository_pin": "pins/agent-red-team.json",
  "procedure_id": "node-census-v1",
  "procedure_version": "v1",
  "capabilities_used": ["git", "gh", "rg", "python3", "jq"],
  "capabilities_missing": [],
  "result": "success",
  "inspected_at": "2026-07-23T18:52:06Z"
}
