{
  "coverage_id": "cov-d9dd87154fdb",
  "repository_pin": "pins/v1-census/federation-recon.json",
  "procedure_id": "node-census-v1",
  "procedure_version": "v1",
  "capabilities_used": ["git", "gh", "rg", "python3", "jq"],
  "capabilities_missing": [],
  "result": "success",
  "inspected_at": "2026-10-13T07:01:32Z"
}
