{
  "coverage_id": "cov-d25402482d18",
  "repository_pin": "pins/agent-world.json",
  "procedure_id": "boundary-drift-recon-v0",
  "procedure_version": "v0",
  "capabilities_used": ["git", "gh", "rg", "bash", "python3", "jq"],
  "capabilities_missing": [],
  "result": "success",
  "inspected_at": "2026-07-23T16:52:36Z"
}
