{
  "coverage_id": "cov-7834ca77f551",
  "repository_pin": "pins/hermes-sankhya-25.json",
  "procedure_id": "node-census-v1",
  "procedure_version": "v1",
  "capabilities_used": ["git", "gh", "rg", "python3", "jq"],
  "capabilities_missing": [],
  "result": "success",
  "inspected_at": "2026-07-23T18:52:06Z"
}
