{
  "coverage_id": "cov-3ba322239883",
  "repository_pin": "pins/v1-census/steward-federation.json",
  "procedure_id": "node-census-v1",
  "procedure_version": "v1",
  "capabilities_used": ["git", "gh", "rg", "python3", "jq"],
  "capabilities_missing": [],
  "result": "success",
  "inspected_at": "2026-09-09T05:05:01Z"
}
