{
  "coverage_id": "cov-2a942153985f",
  "repository_pin": "pins/v1-census/agent-world.json",
  "procedure_id": "node-census-v1",
  "procedure_version": "v1",
  "capabilities_used": ["git", "gh", "rg", "python3", "jq"],
  "capabilities_missing": [],
  "result": "success",
  "inspected_at": "2026-10-20T05:10:16Z"
}
