{
  "coverage_id": "cov-51bac12ccb27",
  "repository_pin": "pins/v0-boundary-drift/federation-recon.json",
  "procedure_id": "boundary-drift-recon-v0",
  "procedure_version": "v0",
  "capabilities_used": ["git", "gh", "rg", "bash", "python3", "jq"],
  "capabilities_missing": [],
  "result": "success",
  "inspected_at": "2026-10-24T04:57:02Z"
}
