{
  "coverage_id": "cov-ce56e1a8df13",
  "repository_pin": "pins/v1-census/steward-test.json",
  "procedure_id": "node-census-v1",
  "procedure_version": "v1",
  "capabilities_used": ["git", "gh", "rg", "python3", "jq"],
  "capabilities_missing": [],
  "result": "success",
  "inspected_at": "2026-07-30T08:15:50Z"
}
